[
  {
    "$schema": "../schemas/research-lead.schema.json",
    "name": "reviewdog",
    "category": "reusable_component",
    "links": [
      "https://github.com/reviewdog/reviewdog"
    ],
    "capabilities": [
      "pr_diagnostics",
      "diff_aware_reporting"
    ],
    "useful_ideas": [
      "Reporter abstraction",
      "Line-level review comments",
      "Local and CI usage"
    ],
    "gap_vs_coprogrammer": "Does not reason about branch intent or semantic integration.",
    "status": "active",
    "notes": "Candidate inspiration for digest finding reporters."
  },
  {
    "$schema": "../schemas/research-lead.schema.json",
    "name": "Danger JS",
    "category": "reusable_component",
    "links": [
      "https://github.com/danger/danger-js"
    ],
    "capabilities": [
      "policy_as_code",
      "pr_comments"
    ],
    "useful_ideas": [
      "Team-specific PR rules",
      "Human-readable PR messaging"
    ],
    "gap_vs_coprogrammer": "Rules run around a PR but do not digest branch intent or rebuild patches.",
    "status": "active",
    "notes": "Useful reference for future scriptable policy hooks."
  },
  {
    "$schema": "../schemas/research-lead.schema.json",
    "name": "Sourcegraph Batch Changes",
    "category": "adjacent_capability",
    "links": [
      "https://sourcegraph.com/docs/batch_changes"
    ],
    "capabilities": [
      "batch_spec",
      "changeset_tracking",
      "large_scale_code_change"
    ],
    "useful_ideas": [
      "Spec-driven desired state",
      "Changeset reconciliation",
      "Progress tracking"
    ],
    "gap_vs_coprogrammer": "Optimizes large-scale planned changes, not multi-agent branch digestion.",
    "status": "watch",
    "notes": "Strong reference for Integration Patch Bot records and reconciliation."
  },
  {
    "$schema": "../schemas/research-lead.schema.json",
    "name": "OpenRewrite",
    "category": "reusable_component",
    "links": [
      "https://docs.openrewrite.org/"
    ],
    "capabilities": [
      "semantic_transformation",
      "recipe_based_refactoring"
    ],
    "useful_ideas": [
      "Recipe model",
      "Lossless semantic tree transformation"
    ],
    "gap_vs_coprogrammer": "Transforms code according to recipes but does not decide branch intent or integration policy.",
    "status": "watch",
    "notes": "Possible deterministic patch primitive for future semantic integration."
  },
  {
    "$schema": "../schemas/research-lead.schema.json",
    "name": "Comby",
    "category": "reusable_component",
    "links": [
      "https://comby.dev/"
    ],
    "capabilities": [
      "structural_search_replace",
      "codemod"
    ],
    "useful_ideas": [
      "Syntax-aware templates",
      "Safer-than-regex code transformations"
    ],
    "gap_vs_coprogrammer": "Patch primitive only; no branch digestion or policy layer.",
    "status": "watch",
    "notes": "Candidate deterministic transformation backend."
  },
  {
    "$schema": "../schemas/research-lead.schema.json",
    "name": "Prow Tide",
    "category": "adjacent_capability",
    "links": [
      "https://docs.prow.k8s.io/docs/components/core/tide/"
    ],
    "capabilities": [
      "merge_pool",
      "batch_testing",
      "status_visibility"
    ],
    "useful_ideas": [
      "Merge pool status",
      "Retest before merge",
      "Dashboard-friendly state"
    ],
    "gap_vs_coprogrammer": "Coordinates merging after review; does not extract or preserve branch insights.",
    "status": "watch",
    "notes": "Reference for queue status, not for semantic integration."
  },
  {
    "$schema": "../schemas/research-lead.schema.json",
    "name": "MergePilot",
    "category": "direct_competitor",
    "links": [
      "https://mergepilot-ai.com/"
    ],
    "capabilities": [
      "multi_pr_merge",
      "ai_conflict_resolution",
      "integration_branch"
    ],
    "useful_ideas": [
      "Slash-command flow",
      "Integration branch UX"
    ],
    "gap_vs_coprogrammer": "Appears conflict-resolution oriented; protocol/digest/record layer remains CoProgrammer differentiation.",
    "status": "watch",
    "notes": "Track closely."
  },
  {
    "$schema": "../schemas/research-lead.schema.json",
    "name": "Paperclip",
    "category": "direct_competitor",
    "links": [
      "https://paperclip.ing/",
      "https://github.com/paperclipai/paperclip",
      "https://docs.paperclip.ing/"
    ],
    "capabilities": [
      "manager_plane",
      "agent_organization",
      "heartbeats",
      "budgets",
      "approvals",
      "bring_your_own_agent"
    ],
    "useful_ideas": [
      "Persistent control plane",
      "Org/team metaphor",
      "Goal/task alignment",
      "Scheduled and event-based heartbeats",
      "Budget and approval governance"
    ],
    "gap_vs_coprogrammer": "Paperclip manages broad AI labor and AI-run companies. CoProgrammer should specialize in repository state, branch digestion, semantic integration, contract risk, and integration records.",
    "status": "active",
    "notes": "Strongest current reference for Manager Plane direction. Track closely but keep CoProgrammer software-integration-specific."
  },
  {
    "$schema": "../schemas/research-lead.schema.json",
    "name": "OpenReview",
    "category": "adjacent_capability",
    "links": [
      "https://github.com/vercel-labs/openreview"
    ],
    "capabilities": [
      "ai_pr_review",
      "github_app",
      "self_hosted_review_bot"
    ],
    "useful_ideas": [
      "Self-hostable GitHub App model",
      "Mention-triggered review",
      "Review artifact generation"
    ],
    "gap_vs_coprogrammer": "Reviews submitted PRs but does not manage leases, branch digestion, or semantic patch reconstruction.",
    "status": "watch",
    "notes": "Reference for future GitHub App packaging."
  },
  {
    "$schema": "../schemas/research-lead.schema.json",
    "name": "GitWand",
    "category": "adjacent_capability",
    "links": [
      "https://gitwand.devlint.fr/"
    ],
    "capabilities": [
      "merge_conflict_resolution",
      "conflict_confidence",
      "local_git_client"
    ],
    "useful_ideas": [
      "Conflict taxonomy",
      "Confidence scoring",
      "MCP surface for agents"
    ],
    "gap_vs_coprogrammer": "Works after conflicts appear; does not preserve branch intent or manage integration decisions.",
    "status": "watch",
    "notes": "Borrow confidence taxonomy for integration risk."
  },
  {
    "$schema": "../schemas/research-lead.schema.json",
    "name": "Pullfrog",
    "category": "adjacent_capability",
    "links": [
      "https://pullfrog.com/"
    ],
    "capabilities": [
      "mention_triggered_agents",
      "issue_triage",
      "ci_fixing",
      "merge_conflict_fixing"
    ],
    "useful_ideas": [
      "Mention-triggered agent task UX",
      "Repository instructions",
      "GitHub Actions execution model"
    ],
    "gap_vs_coprogrammer": "General agent execution layer; CoProgrammer should specialize in Manager Plane state and integration artifacts.",
    "status": "watch",
    "notes": "Useful for command UX and GitHub-native workflow."
  },
  {
    "$schema": "../schemas/research-lead.schema.json",
    "name": "Renovate",
    "category": "adjacent_capability",
    "links": [
      "https://github.com/renovatebot/renovate",
      "https://docs.renovatebot.com/"
    ],
    "capabilities": [
      "policy_config",
      "automated_prs",
      "dependency_dashboard",
      "confidence_metadata"
    ],
    "useful_ideas": [
      "Highly configurable repository policy",
      "Generated PR bodies",
      "Dashboard issue pattern",
      "Automerge gated by policy"
    ],
    "gap_vs_coprogrammer": "Domain-specific dependency automation; does not manage multi-agent coding integration.",
    "status": "watch",
    "notes": "Borrow dashboard issue and policy configuration patterns."
  },
  {
    "$schema": "../schemas/research-lead.schema.json",
    "name": "Probot",
    "category": "reusable_component",
    "links": [
      "https://github.com/probot/probot",
      "https://probot.github.io/"
    ],
    "capabilities": [
      "github_app_framework",
      "webhook_routing",
      "automation_runtime"
    ],
    "useful_ideas": [
      "GitHub App event routing",
      "App packaging model",
      "Webhook-first automation"
    ],
    "gap_vs_coprogrammer": "Framework only; CoProgrammer still owns semantic integration protocol.",
    "status": "watch",
    "notes": "Candidate implementation framework if moving beyond GitHub Actions."
  },
  {
    "$schema": "../schemas/research-lead.schema.json",
    "name": "Grit",
    "category": "reusable_component",
    "links": [
      "https://docs.grit.io/"
    ],
    "capabilities": [
      "declarative_code_transform",
      "code_migration",
      "pr_generation"
    ],
    "useful_ideas": [
      "Declarative migration language",
      "Patch generation workflow",
      "AI-assisted migration surface"
    ],
    "gap_vs_coprogrammer": "Transformation layer; not a Manager Plane or semantic integration governance system.",
    "status": "watch",
    "notes": "Candidate deterministic patch primitive."
  },
  {
    "$schema": "../schemas/research-lead.schema.json",
    "name": "CodeRabbit",
    "category": "adjacent_capability",
    "links": [
      "https://docs.coderabbit.ai/guides/code-review-overview"
    ],
    "capabilities": [
      "ai_pr_review",
      "review_summary",
      "inline_comments"
    ],
    "useful_ideas": [
      "Reviewer-facing summaries",
      "Continuous PR feedback",
      "Review UX"
    ],
    "gap_vs_coprogrammer": "Reviews PRs as submitted; does not own branch-intent digestion or integration records.",
    "status": "watch",
    "notes": "Commercial adjacent tool; integrate signals rather than replace."
  },
  {
    "$schema": "../schemas/research-lead.schema.json",
    "name": "GitHub Copilot Code Review",
    "category": "adjacent_capability",
    "links": [